{
  "schema_version": "0.1",
  "audit_id": "mega-d-a-claude-watermark-claims",
  "captured_at_utc": "2026-08-15T15:53:53.8986491Z",
  "classification_definitions": {
    "supported": "The claim stays within the observable and is backed by authority sufficient for that exact inference.",
    "accurately_limited": "The claim expressly limits itself to the observable or correctly states an authority or inference boundary.",
    "unsupported_provider_inference": "The claim presents or implies an Anthropic production detection or removal result without authority for Anthropic's deployed configuration and detector.",
    "overstated_authorship_inference": "The claim upgrades watermark or provider-involvement evidence into authorship, ownership, or responsibility.",
    "unresolved": "The captured material is too ambiguous or incomplete to support a stronger classification.",
    "mechanism_demo_not_provider_detector": "The claim accurately demonstrates a public watermark mechanism or configuration and does not establish an Anthropic production result."
  },
  "authority_class_definitions": {
    "none": "No verifier, implementation, or reproducible observation supporting the inference is exposed in the captured source.",
    "public_observation": "A publicly reproducible observation such as Unicode code-point inspection, without provider-watermark authority.",
    "public_reference": "A public mechanism specification or implementation evaluated under its own disclosed configuration.",
    "provider_gated": "Provider-specific key, configuration, detector, or API authority not publicly available in the captured sources.",
    "public_verification": "A publicly available verifier with authority for the exact deployed mechanism and configuration being claimed."
  },
  "claims": [
    {
      "claim_id": "claudewatermark-unicode-provider-detection",
      "source_id": "claudewatermark-home",
      "captured_at_utc": "2026-08-15T15:53:53.8986491Z",
      "claim_text": "Find hidden characters that AI detection systems use to identify content produced by Claude, and other AI tools.",
      "claim_scope": "provider_detection",
      "observable": "The captured page's client-side code checks a fixed list of Unicode code points and reports or removes matches.",
      "required_authority": "provider_gated",
      "available_authority": "public_observation",
      "classification": "unsupported_provider_inference",
      "rationale": "Unicode membership is reproducible, but Anthropic states that its text watermark adds no hidden characters and detection uses Anthropic's key. The Unicode result cannot be upgraded to an Anthropic production-watermark result.",
      "supporting_source_ids": [
        "claudewatermark-home",
        "anthropic-claude-text-watermark"
      ],
      "limitations": [
        "The audit inspected the captured page copy and client-side code but did not submit text to the live service.",
        "The classification applies to this quoted provider-identification claim, not to the page's separate Unicode-cleaning capability."
      ]
    },
    {
      "claim_id": "gptcleanup-supported-hidden-unicode",
      "source_id": "gptcleanup-claude-watermark-cleaner",
      "captured_at_utc": "2026-08-15T15:53:53.8986491Z",
      "claim_text": "Detect and remove supported hidden Unicode characters from Claude text",
      "claim_scope": "unicode_observation",
      "observable": "The quoted subtitle limits the operation to supported hidden Unicode characters in submitted text.",
      "required_authority": "public_observation",
      "available_authority": "public_observation",
      "classification": "accurately_limited",
      "rationale": "The exact claim is about Unicode observation and cleanup, not an authoritative Anthropic statistical-watermark decision.",
      "supporting_source_ids": [
        "gptcleanup-claude-watermark-cleaner",
        "anthropic-claude-text-watermark"
      ],
      "limitations": [
        "The page title uses watermark remover and detector language; this record classifies only the narrower quoted subtitle.",
        "The audit did not submit text to the live service or assess transformation correctness."
      ]
    },
    {
      "claim_id": "overchat-claude-detection-100-percent",
      "source_id": "overchat-claude-watermark-article",
      "captured_at_utc": "2026-08-15T15:53:53.8986491Z",
      "claim_text": "allowing AI checkers to detect copy generated by Claude with 100% accuracy.",
      "claim_scope": "provider_detection",
      "observable": "The captured article states a performance number but exposes no evaluated detector, dataset, threshold, or result for that number.",
      "required_authority": "public_verification",
      "available_authority": "none",
      "classification": "unsupported_provider_inference",
      "rationale": "Anthropic describes probabilistic likelihood, weaker detection on small or constrained samples, a provider key, and a detection API whose implementation details are still being worked out. The captured page does not support universal 100% accuracy.",
      "supporting_source_ids": [
        "overchat-claude-watermark-article",
        "anthropic-claude-text-watermark"
      ],
      "limitations": [
        "No claim is made about evaluations or private integrations not disclosed on the captured page.",
        "The article also contains narrower caveats; this classification applies only to the quoted accuracy claim."
      ]
    },
    {
      "claim_id": "overchat-private-detector-caveat",
      "source_id": "overchat-claude-watermark-article",
      "captured_at_utc": "2026-08-15T15:53:53.8986491Z",
      "claim_text": "Anthropic has not yet published its complete detection specification",
      "claim_scope": "authority_limitation",
      "observable": "The article distinguishes Unicode cleanup and model-assisted rewriting from verification against Anthropic's detector.",
      "required_authority": "provider_gated",
      "available_authority": "public_observation",
      "classification": "accurately_limited",
      "rationale": "The limitation matches Anthropic's current statement that a detection API will be offered soon and implementation details are still being worked out.",
      "supporting_source_ids": [
        "overchat-claude-watermark-article",
        "anthropic-claude-text-watermark"
      ],
      "limitations": [
        "This is a statement about the current public specification, not a claim that public verification is impossible in general.",
        "Authorized non-public access, if any, is outside the captured public record."
      ]
    },
    {
      "claim_id": "google-synthid-open-source-mechanism",
      "source_id": "google-synthid-safeguards",
      "captured_at_utc": "2026-08-15T15:53:53.8986491Z",
      "claim_text": "SynthID Text has been open sourced to make watermarking for text generation available to developers.",
      "claim_scope": "mechanism_demonstration",
      "observable": "Official documentation describes configurable watermark application and probabilistic detection, including private, semi-private, and public verifier deployment options.",
      "required_authority": "public_reference",
      "available_authority": "public_reference",
      "classification": "mechanism_demo_not_provider_detector",
      "rationale": "The public mechanism and detector are real and usable under their own configuration. The documentation also says configurations should be stored securely and privately; it does not supply Anthropic's production key or establish Anthropic parity.",
      "supporting_source_ids": [
        "google-synthid-safeguards",
        "anthropic-claude-text-watermark"
      ],
      "limitations": [
        "The audit did not execute or benchmark the public implementation.",
        "This classification does not imply that watermark verification must always remain provider-gated."
      ]
    },
    {
      "claim_id": "synthid-text-reference-implementation",
      "source_id": "google-deepmind-synthid-text",
      "captured_at_utc": "2026-08-15T15:53:53.8986491Z",
      "claim_text": "This repository provides a reference implementation of the SynthID Text watermarking and detection capabilities",
      "claim_scope": "mechanism_demonstration",
      "observable": "The pinned repository provides JAX reference watermarking and detection code and explicitly says it is not intended for production use.",
      "required_authority": "public_reference",
      "available_authority": "public_reference",
      "classification": "mechanism_demo_not_provider_detector",
      "rationale": "The repository supports reference-mechanism experiments under a chosen configuration. Its own scope and the missing Anthropic configuration prevent an Anthropic production inference.",
      "supporting_source_ids": [
        "google-deepmind-synthid-text",
        "google-synthid-safeguards",
        "anthropic-claude-text-watermark"
      ],
      "limitations": [
        "The audit inspected the pinned README and did not execute the repository.",
        "Reference status does not make the code useless; it defines the authority boundary of results produced with it."
      ]
    },
    {
      "claim_id": "watermarks-remover-vendor-detector-caveat",
      "source_id": "watermarks-remover-repository",
      "captured_at_utc": "2026-08-15T15:53:53.8986491Z",
      "claim_text": "It cannot certify that vendor detectors will fail.",
      "claim_scope": "authority_limitation",
      "observable": "The pinned README separates verifiable Unicode and metadata actions from best-effort statistical-text rewriting and same-configuration public harnesses.",
      "required_authority": "provider_gated",
      "available_authority": "public_reference",
      "classification": "accurately_limited",